{
  "report_id": "comparison-watchlist-2026-05-19",
  "scope_label": "watchlist_activa",
  "candidate_ids": ["ivan-cepeda", "abelardo-de-la-espriella", "paloma-valencia", "claudia-lopez", "sergio-fajardo", "luis-gilberto-murillo"],
  "source_ids": ["src-20260418-ivan-tunja", "src-20260418-ivan-anticorrup", "src-20260418-ivan-program-home", "src-20260420-ivan-program-pdf", "src-20260507-ivan-software-electoral-oficial", "src-20260510-ivan-microempresas-vanguardia", "src-20260418-ivan-economia", "src-20260518-ivan-paz-rcn", "src-20260501-ivan-constituyente-elpais", "src-20260502-ivan-trabajo-sindicatos-api", "src-20260421-ivan-vanguardia", "src-20260518-ivan-lgbti-elpais", "src-20260419-ivan-debate-elpais", "src-20260418-ivan-profile", "src-manual-195a1706", "src-20260420-abelardo-program-pdf", "src-20260424-abelardo-colpensiones-elpais", "src-20260418-abelardo-infobae", "src-20260513-abelardo-protesta-infobae", "src-20260507-abelardo-char-elpais", "src-20260422-abelardo-infobae", "src-20260419-abelardo-debate-elpais", "src-20260418-abelardo-profile", "src-manual-21c82915", "src-20260418-paloma-official", "src-20260420-paloma-program-pdf", "src-20260512-paloma-medicamentos-caracol", "src-20260424-paloma-seguridad-elpais", "src-20260501-paloma-seguridad-api", "src-20260506-paloma-soat-regalias-bluradio", "src-20260502-paloma-meta-infraestructura-api", "src-20260507-paloma-prestamo-eeuu-infobae", "src-20260419-paloma-debate-elpais", "src-20260419-paloma-energia-elpais", "src-20260418-paloma-elpais", "src-20260418-paloma-profile", "src-20260418-paloma-eltiempo", "src-manual-10314ccb", "src-manual-1cf85d8c", "src-manual-21c198da", "src-20260418-claudia-program", "src-20260420-claudia-program-pdf", "src-20260514-claudia-salud-caracol", "src-20260516-claudia-policia-local-caracoltv", "src-20260512-claudia-plan-gobierno-elespectador", "src-20260418-claudia-forbes", "src-20260424-claudia-debates-elpais", "src-20260422-claudia-infobae", "src-20260419-claudia-energia-elpais", "src-20260418-claudia-profile", "src-manual-05f40435", "src-manual-09f50ce0", "src-manual-1e42b541", "src-20260418-fajardo-official", "src-20260420-fajardo-program-pdf", "src-20260514-fajardo-salud-caracol", "src-20260516-fajardo-50000-policias-caracoltv", "src-20260512-fajardo-plan-gobierno-elespectador", "src-20260423-fajardo-espectador", "src-20260506-fajardo-educacion-elpais", "src-20260507-fajardo-seguridad-infobae", "src-20260419-sergio-debate-elpais", "src-20260419-sergio-energia-elpais", "src-20260418-sergio-profile", "src-manual-4895df7e", "src-20260420-murillo-program-home", "src-20260506-murillo-retiro-cepeda-elpais", "src-20260418-murillo-espectador", "src-20260507-murillo-adhesion-cepeda-elpais", "src-20260501-murillo-coordinacion-territorial-elcolombiano", "src-20260421-murillo-tiempo", "src-20260418-murillo-elpais", "src-20260418-murillo-profile", "src-manual-5bbd0995", "src-manual-40921854"],
  "claim_ids": ["claim-20260418-ivan-bio", "claim-20260418-ivan-paz-total", "claim-20260418-ivan-economia", "claim-20260418-ivan-transicion", "claim-20260418-ivan-anticorrupcion", "claim-20260418-ivan-tierras", "claim-20260418-ivan-tren", "claim-20260419-ivan-reto-debate", "src-20260418-ivan-tunja-claim-1", "src-20260418-ivan-anticorrup-claim-1", "src-20260418-ivan-anticorrup-claim-2", "src-20260418-ivan-program-home-claim-1", "src-20260420-ivan-program-pdf-claim-1", "src-20260507-ivan-software-electoral-oficial-claim-1", "src-20260510-ivan-microempresas-vanguardia-claim-1", "src-20260418-ivan-economia-claim-1", "src-20260518-ivan-paz-rcn-claim-1", "src-20260501-ivan-constituyente-elpais-claim-1", "src-20260502-ivan-trabajo-sindicatos-api-claim-1", "src-20260421-ivan-vanguardia-claim-1", "src-20260421-ivan-vanguardia-claim-2", "src-20260518-ivan-lgbti-elpais-claim-1", "src-20260419-ivan-debate-elpais-claim-1", "src-20260419-ivan-debate-elpais-claim-2", "src-20260418-ivan-profile-claim-1", "src-manual-195a1706-claim-1", "claim-20260418-abelardo-bio", "claim-20260418-abelardo-estado", "claim-20260418-abelardo-jep", "claim-20260418-abelardo-impuestos", "claim-20260418-abelardo-carceles", "claim-20260418-abelardo-seguridad", "claim-20260418-abelardo-economia", "claim-20260418-abelardo-salud", "claim-20260419-abelardo-acepta-debate", "src-20260420-abelardo-program-pdf-claim-1", "src-20260420-abelardo-program-pdf-claim-2", "src-20260420-abelardo-program-pdf-claim-3", "src-20260424-abelardo-colpensiones-elpais-claim-1", "src-20260418-abelardo-infobae-claim-1", "src-20260513-abelardo-protesta-infobae-claim-1", "src-20260507-abelardo-char-elpais-claim-1", "src-20260422-abelardo-infobae-claim-1", "src-20260422-abelardo-infobae-claim-2", "src-20260419-abelardo-debate-elpais-claim-1", "src-20260419-abelardo-debate-elpais-claim-2", "src-20260418-abelardo-profile-claim-1", "src-20260418-abelardo-profile-claim-2", "src-manual-21c82915-claim-1", "claim-20260418-paloma-bio", "claim-20260418-paloma-energia", "claim-20260418-paloma-vias", "claim-20260418-paloma-educacion", "claim-20260418-paloma-formalizacion", "claim-20260418-paloma-vivienda", "claim-20260418-paloma-seguridad", "claim-20260418-paloma-salud", "claim-20260418-paloma-carceles", "claim-20260419-paloma-energia-foro", "claim-20260419-paloma-acepta-debate", "src-20260418-paloma-official-claim-1", "src-20260418-paloma-official-claim-2", "src-20260420-paloma-program-pdf-claim-1", "src-20260420-paloma-program-pdf-claim-2", "src-20260420-paloma-program-pdf-claim-3", "src-20260512-paloma-medicamentos-caracol-claim-1", "src-20260424-paloma-seguridad-elpais-claim-1", "src-20260501-paloma-seguridad-api-claim-1", "src-20260506-paloma-soat-regalias-bluradio-claim-1", "src-20260502-paloma-meta-infraestructura-api-claim-1", "src-20260507-paloma-prestamo-eeuu-infobae-claim-1", "src-20260419-paloma-debate-elpais-claim-1", "src-20260419-paloma-debate-elpais-claim-2", "src-20260419-paloma-energia-elpais-claim-1", "src-20260419-paloma-energia-elpais-claim-2", "src-20260418-paloma-elpais-claim-1", "src-20260418-paloma-profile-claim-1", "src-20260418-paloma-profile-claim-2", "src-20260418-paloma-eltiempo-claim-1", "src-manual-10314ccb-claim-1", "src-manual-1cf85d8c-claim-1", "src-manual-21c198da-claim-1", "claim-20260418-claudia-bio", "claim-20260418-claudia-seguridad", "claim-20260418-claudia-justicia", "claim-20260418-claudia-cuidado", "claim-20260418-claudia-genero", "claim-20260418-claudia-educacion", "claim-20260418-claudia-vivienda", "claim-20260418-claudia-agua", "claim-20260418-claudia-fiscal", "claim-20260418-claudia-salud", "claim-20260419-claudia-mineria-social", "src-20260418-claudia-program-claim-1", "src-20260418-claudia-program-claim-2", "src-20260420-claudia-program-pdf-claim-1", "src-20260514-claudia-salud-caracol-claim-1", "src-20260516-claudia-policia-local-caracoltv-claim-1", "src-20260512-claudia-plan-gobierno-elespectador-claim-1", "src-20260512-claudia-plan-gobierno-elespectador-claim-2", "src-20260418-claudia-forbes-claim-1", "src-20260418-claudia-forbes-claim-2", "src-20260424-claudia-debates-elpais-claim-1", "src-20260422-claudia-infobae-claim-1", "src-20260422-claudia-infobae-claim-2", "src-20260419-claudia-energia-elpais-claim-1", "src-20260419-claudia-energia-elpais-claim-2", "src-20260418-claudia-profile-claim-1", "src-20260418-claudia-profile-claim-2", "src-manual-05f40435-claim-1", "src-manual-09f50ce0-claim-1", "src-manual-1e42b541-claim-1", "claim-20260418-sergio-bio", "claim-20260418-fajardo-seguridad", "claim-20260418-fajardo-paz", "claim-20260418-fajardo-anticorrupcion", "claim-20260418-fajardo-salud", "claim-20260418-fajardo-mujeres", "claim-20260419-sergio-energia-legalidad", "claim-20260419-fajardo-listo-debate", "src-20260418-fajardo-official-claim-1", "src-20260420-fajardo-program-pdf-claim-1", "src-20260514-fajardo-salud-caracol-claim-1", "src-20260516-fajardo-50000-policias-caracoltv-claim-1", "src-20260512-fajardo-plan-gobierno-elespectador-claim-1", "src-20260512-fajardo-plan-gobierno-elespectador-claim-2", "src-20260423-fajardo-espectador-claim-1", "src-20260423-fajardo-espectador-claim-2", "src-20260506-fajardo-educacion-elpais-claim-1", "src-20260507-fajardo-seguridad-infobae-claim-1", "src-20260419-sergio-debate-elpais-claim-1", "src-20260419-sergio-debate-elpais-claim-2", "src-20260419-sergio-energia-elpais-claim-1", "src-20260419-sergio-energia-elpais-claim-2", "src-20260418-sergio-profile-claim-1", "src-manual-4895df7e-claim-1", "claim-20260418-murillo-bio", "claim-20260418-murillo-educacion", "claim-20260418-murillo-seguridad", "claim-20260418-murillo-puertos", "claim-20260418-murillo-alianza", "claim-20260418-murillo-regiones", "src-20260420-murillo-program-home-claim-1", "src-20260420-murillo-program-home-claim-2", "src-20260420-murillo-program-home-claim-3", "src-20260506-murillo-retiro-cepeda-elpais-claim-1", "src-20260418-murillo-espectador-claim-1", "src-20260507-murillo-adhesion-cepeda-elpais-claim-1", "src-20260501-murillo-coordinacion-territorial-elcolombiano-claim-1", "src-20260421-murillo-tiempo-claim-1", "src-20260421-murillo-tiempo-claim-2", "src-20260418-murillo-elpais-claim-1", "src-20260418-murillo-profile-claim-1", "src-20260418-murillo-profile-claim-2", "src-manual-5bbd0995-claim-1", "src-manual-40921854-claim-1"],
  "axes_comparison": [
    {
      "axis_id": "estado_vs_mercado",
      "candidate_positions": [
        {
          "candidate_id": "ivan-cepeda",
          "placement": "Estado coordinador",
          "confidence": 0.95
        },
        {
          "candidate_id": "abelardo-de-la-espriella",
          "placement": "Estado coordinador",
          "confidence": 0.81
        },
        {
          "candidate_id": "paloma-valencia",
          "placement": "Estado coordinador",
          "confidence": 0.88
        },
        {
          "candidate_id": "claudia-lopez",
          "placement": "Estado coordinador",
          "confidence": 0.86
        },
        {
          "candidate_id": "sergio-fajardo",